{
  "schema": "coursecraft.structure/1",
  "run_id": "cc:run:74ffddd8-382c-4365-aaf1-4ae1730fe3a2",
  "source": {
    "source_lineage_key": "cc:lineage:431334cbe13f558a2d72c27c9ee50df8",
    "source_instance_key": "cc:source:d08688cdb116c668b097ac3ef673567150a0001f8bf2b0128cb5f49298a20e36",
    "lineage_state": "unresolved",
    "lineage_basis": "logical_fingerprint",
    "lineage_candidates": [
      {
        "basis": "manifest_identifier",
        "value": "SAMPLE-ROBUST",
        "stability_class": "package_lineage_identifier"
      }
    ],
    "lineage_diagnostics": [
      "primary_identifiers_incomplete"
    ],
    "source_name": "sample_export.zip",
    "logical_fingerprint": {
      "algorithm": "sha256",
      "digest": "d08688cdb116c668b097ac3ef673567150a0001f8bf2b0128cb5f49298a20e36",
      "scope": "logical_file_set",
      "file_count": 30,
      "bytes": 21857,
      "extensions": {
        "skipped_symlink_count": 0
      }
    },
    "transport_fingerprint": {
      "algorithm": "sha256",
      "digest": "8d3f30d12ce71cd75551b40407b59ba52525cebdec61266ca67f852a39f0d64f",
      "scope": "transport_file",
      "bytes": 11538,
      "extensions": {}
    },
    "observed_identity": {
      "source_name": "sample_export.zip",
      "org_unit_id": null,
      "course_code": null,
      "export_timestamp": null,
      "orgunit_identifier": null,
      "orgunit_code": null,
      "orgunit_name": null,
      "manifest_identifier": "SAMPLE-ROBUST",
      "manifest_title": null,
      "manifest_course_code": null,
      "organization_title": null,
      "org_unit_id_basis": null
    },
    "extensions": {}
  },
  "export": "examples/sample_export.zip",
  "label": "sample_course",
  "kind_counts": {
    "module": 3,
    "html_topic": 12,
    "content_file": 2,
    "dropbox_link": 3,
    "quiz_link": 2,
    "discussion_link": 2,
    "checklist_link": 1
  },
  "tree": [
    {
      "title": "Getting Started",
      "identifier": "M0",
      "identifierref": "RES_MOD0",
      "kind": "module",
      "href": "",
      "rcode": "",
      "is_hidden": false,
      "resource_code": "",
      "description": "",
      "flags": [],
      "children": [
        {
          "title": "Course Introduction",
          "identifier": "P0A",
          "identifierref": "RES_COURSE_INTRO",
          "kind": "html_topic",
          "href": "pages/course-introduction.html",
          "rcode": "",
          "is_hidden": false,
          "resource_code": "",
          "description": "",
          "flags": [],
          "children": [],
          "entity_key": "cc:entity:a489c602aa42bc9c43620abc3784eded",
          "identity": {
            "quality": "scoped_source_id",
            "basis": "identifier",
            "source_lineage_key": "cc:lineage:431334cbe13f558a2d72c27c9ee50df8",
            "source_aliases": [
              {
                "kind": "identifier",
                "value": "P0A"
              },
              {
                "kind": "identifierref",
                "value": "RES_COURSE_INTRO"
              },
              {
                "kind": "href",
                "value": "pages/course-introduction.html"
              }
            ],
            "extensions": {}
          },
          "parent_entity_key": "cc:entity:aeec9e042f39d1e74dae8376c963f949"
        },
        {
          "title": "Course Description",
          "identifier": "P0B",
          "identifierref": "RES_COURSE_DESCRIPTION",
          "kind": "html_topic",
          "href": "pages/course-description.html",
          "rcode": "",
          "is_hidden": false,
          "resource_code": "",
          "description": "",
          "flags": [],
          "children": [],
          "entity_key": "cc:entity:5d27b4a49e23c8cf997108795f3d8810",
          "identity": {
            "quality": "scoped_source_id",
            "basis": "identifier",
            "source_lineage_key": "cc:lineage:431334cbe13f558a2d72c27c9ee50df8",
            "source_aliases": [
              {
                "kind": "identifier",
                "value": "P0B"
              },
              {
                "kind": "identifierref",
                "value": "RES_COURSE_DESCRIPTION"
              },
              {
                "kind": "href",
                "value": "pages/course-description.html"
              }
            ],
            "extensions": {}
          },
          "parent_entity_key": "cc:entity:aeec9e042f39d1e74dae8376c963f949"
        },
        {
          "title": "Course Materials",
          "identifier": "P0C",
          "identifierref": "RES_COURSE_MATERIALS",
          "kind": "html_topic",
          "href": "pages/course-materials.html",
          "rcode": "",
          "is_hidden": false,
          "resource_code": "",
          "description": "",
          "flags": [],
          "children": [],
          "entity_key": "cc:entity:f2b87b4db6cc896d90151136ef10db33",
          "identity": {
            "quality": "scoped_source_id",
            "basis": "identifier",
            "source_lineage_key": "cc:lineage:431334cbe13f558a2d72c27c9ee50df8",
            "source_aliases": [
              {
                "kind": "identifier",
                "value": "P0C"
              },
              {
                "kind": "identifierref",
                "value": "RES_COURSE_MATERIALS"
              },
              {
                "kind": "href",
                "value": "pages/course-materials.html"
              }
            ],
            "extensions": {}
          },
          "parent_entity_key": "cc:entity:aeec9e042f39d1e74dae8376c963f949"
        },
        {
          "title": "Course Learning Outcomes",
          "identifier": "P0D",
          "identifierref": "RES_COURSE_OUTCOMES",
          "kind": "html_topic",
          "href": "pages/course-outcomes.html",
          "rcode": "",
          "is_hidden": false,
          "resource_code": "",
          "description": "",
          "flags": [],
          "children": [],
          "entity_key": "cc:entity:e05d9c76944881a4f3dae03c93672517",
          "identity": {
            "quality": "scoped_source_id",
            "basis": "identifier",
            "source_lineage_key": "cc:lineage:431334cbe13f558a2d72c27c9ee50df8",
            "source_aliases": [
              {
                "kind": "identifier",
                "value": "P0D"
              },
              {
                "kind": "identifierref",
                "value": "RES_COURSE_OUTCOMES"
              },
              {
                "kind": "href",
                "value": "pages/course-outcomes.html"
              }
            ],
            "extensions": {}
          },
          "parent_entity_key": "cc:entity:aeec9e042f39d1e74dae8376c963f949"
        },
        {
          "title": "Project Roadmap and Setup",
          "identifier": "P0E",
          "identifierref": "RES_PROJECT_ROADMAP",
          "kind": "html_topic",
          "href": "pages/project-roadmap.html",
          "rcode": "",
          "is_hidden": false,
          "resource_code": "",
          "description": "",
          "flags": [],
          "children": [],
          "entity_key": "cc:entity:a5642e25e8032a9b18550bc704ba1c68",
          "identity": {
            "quality": "scoped_source_id",
            "basis": "identifier",
            "source_lineage_key": "cc:lineage:431334cbe13f558a2d72c27c9ee50df8",
            "source_aliases": [
              {
                "kind": "identifier",
                "value": "P0E"
              },
              {
                "kind": "identifierref",
                "value": "RES_PROJECT_ROADMAP"
              },
              {
                "kind": "href",
                "value": "pages/project-roadmap.html"
              }
            ],
            "extensions": {}
          },
          "parent_entity_key": "cc:entity:aeec9e042f39d1e74dae8376c963f949"
        }
      ],
      "entity_key": "cc:entity:aeec9e042f39d1e74dae8376c963f949",
      "identity": {
        "quality": "scoped_source_id",
        "basis": "identifier",
        "source_lineage_key": "cc:lineage:431334cbe13f558a2d72c27c9ee50df8",
        "source_aliases": [
          {
            "kind": "identifier",
            "value": "M0"
          },
          {
            "kind": "identifierref",
            "value": "RES_MOD0"
          }
        ],
        "extensions": {}
      },
      "parent_entity_key": null
    },
    {
      "title": "Week 1",
      "identifier": "M1",
      "identifierref": "RES_MOD1",
      "kind": "module",
      "href": "",
      "rcode": "",
      "is_hidden": false,
      "resource_code": "",
      "description": "",
      "flags": [],
      "children": [
        {
          "title": "Week 1 Overview",
          "identifier": "P1",
          "identifierref": "RES_W1_OVERVIEW",
          "kind": "html_topic",
          "href": "pages/week1-overview.html",
          "rcode": "",
          "is_hidden": false,
          "resource_code": "",
          "description": "",
          "flags": [],
          "children": [],
          "entity_key": "cc:entity:7146d038d3aaa697349d7450307b9c5e",
          "identity": {
            "quality": "scoped_source_id",
            "basis": "identifier",
            "source_lineage_key": "cc:lineage:431334cbe13f558a2d72c27c9ee50df8",
            "source_aliases": [
              {
                "kind": "identifier",
                "value": "P1"
              },
              {
                "kind": "identifierref",
                "value": "RES_W1_OVERVIEW"
              },
              {
                "kind": "href",
                "value": "pages/week1-overview.html"
              }
            ],
            "extensions": {}
          },
          "parent_entity_key": "cc:entity:02f86dd4cf53d0da7f43747c90ba5af4"
        },
        {
          "title": "Week 1 Learning Objectives",
          "identifier": "P2",